H6298,Local CCP,HEALTHSPAN INTEGRATED CARE,HealthSpan,Catholic Health Partners,Plan too new to be measured,Plan too new to be measured,Plan too new to be measured,Plan too new to be measured,Plan too new to be measured,Plan too new to be measured,Plan too new to be measured,Plan not required to report measure,Plan not required to report measure,Plan not required to report measure,Plan not required to report measure,Plan too new to be measured,Plan too new to be measured,Plan too new to be measured,Plan too new to be measured,Plan too new to be measured,Plan too new to be measured,Plan too new to be measured,Plan too new to be measured,Plan too new to be measured,Plan too new to be measured,Plan too new to be measured,Plan too new to be measured,Plan too new to be measured,Plan too new to be measured,Plan too new to be measured,Plan too new to be measured,Plan too new to be measured,Plan too new to be measured,Plan too new to be measured,Plan too new to be measured,3,2,Plan too new to be measured,Plan too new to be measured,Plan too new to be measured,Plan too new to be measured,Plan too new to be measured,Plan too new to be measured,Plan too new to be measured,Plan too new to be measured,Plan too new to be measured,Plan too new to be measured,Plan too new to be measured,Plan too new to be measured,Plan too new to be measured,Plan too new to be measured
H6306,Local CCP,FIRSTCAROLINACARE INSURANCE COMPANY,FirstCarolinaCare Insurance Company,"FirstHealth of the Carolinas, Inc.",Not enough data available,4,4,Plan too new to be measured,Plan too new to be measured,2,5,Plan not required to report measure,Plan not required to report measure,Plan not required to report measure,Plan not required to report measure,Not enough data available,2,3,4,3,Not enough data available,1,2,5,4,5,5,5,4,5,5,5,5,Not enough data available,Not enough data available,4,5,5,Not enough data available,5,5,5,4,5,5,3,5,3,3,3,2
H6308,Demo,"AGEWELL NEW YORK, LLC",AgeWell New York FIDA Plan,"ParkerCare New York, LLC",Plan too new to be measured,Plan too new to be measured,Plan too new to be measured,Plan too new to be measured,Plan too new to be measured,Plan too new to be measured,Plan too new to be measured,Plan not required to report measure,Plan not required to report measure,Plan not required to report measure,Plan not required to report measure,Plan too new to be measured,Plan too new to be measured,Plan too new to be measured,Plan too new to be measured,Plan too new to be measured,Plan too new to be measured,Plan too new to be measured,Plan too new to be measured,Plan too new to be measured,Plan too new to be measured,Plan too new to be measured,Plan too new to be measured,Plan too new to be measured,Plan too new to be measured,Plan too new to be measured,Plan too new to be measured,Plan too new to be measured,Plan too new to be measured,Plan too new to be measured,Plan too new to be measured,Not enough data available,Not enough data available,Plan too new to be measured,Plan too new to be measured,Plan too new to be measured,Plan too new to be measured,Plan too new to be measured,Plan too new to be measured,Plan too new to be measured,Plan too new to be measured,Plan too new to be measured,Plan too new to be measured,Plan too new to be measured,Plan too new to be measured,Plan too new to be measured,Plan too new to be measured
H6320,Local CCP,"FRESENIUS HEALTH PLANS OF NORTH CAROLINA, INC.",Fresenius Health Plans,Fresenius Medicare Care AG & Co. KGaA,Plan too new to be measured,Plan too new to be measured,Plan too new to be measured,Plan too new to be measured,Plan too new to be measured,Plan too new to be measured,Plan too new to be measured,Plan too new to be measured,Plan too new to be measured,Plan too new to be measured,Plan too new to be measured,Plan too new to be measured,Plan too new to be measured,Plan too new to be measured,Plan too new to be measured,Plan too new to be measured,Plan too new to be measured,Plan too new to be measured,Plan too new to be measured,Plan too new to be measured,Plan too new to be measured,Plan too new to be measured,Plan too new to be measured,Plan too new to be measured,Plan too new to be measured,Plan too new to be measured,Plan too new to be measured,Plan too new to be measured,Plan too new to be measured,Plan too new to be measured,Plan too new to be measured,Plan too new to be measured,Plan too new to be measured,Plan too new to be measured,Plan too new to be measured,Plan too new to be measured,Plan too new to be measured,Plan too new to be measured,Plan too new to be measured,Plan too new to be measured,Plan too new to be measured,Plan too new to be measured,Plan too new to be measured,Plan too new to be measured,Plan too new to be measured,Plan too new to be measured,Plan too new to be measured
H6328,Local CCP,"CARE N' CARE INSURANCE COMPANY, INC.",Care NÆ Care Insurance Company,North Texas Specialty Physicians,4,3,4,3,5,4,4,Plan not required to report measure,Plan not required to report measure,Plan not required to report measure,Plan not required to report measure,2,3,4,4,4,4,2,4,4,3,5,4,4,4,3,4,5,3,Not enough data available,Not enough data available,3,3,5,Not enough data available,3,4,5,2,4,4,3,3,4,4,4,1
H6360,1876 Cost,HEALTHSPAN INTEGRATED CARE,HealthSpan,Catholic Health Partners,5,5,5,2,1,4,5,Plan not required to report measure,Plan not required to report measure,Plan not required to report measure,Plan not required to report measure,4,4,5,4,4,4,3,5,4,5,3,4,2,3,4,4,5,1,5,4,Plan not required to report measure,Plan not required to report measure,5,Not enough data available,4,4,5,2,4,1,5,5,5,5,5,4
H6361,Local CCP,"TODAY'S OPTIONS OF NEW YORK, INC.","Today's Options of New York, Inc.",Universal American Corp.,Plan too new to be measured,Plan too new to be measured,Plan too new to be measured,Plan too new to be measured,Plan too new to be measured,Plan too new to be measured,Plan too new to be measured,Plan not required to report measure,Plan not required to report measure,Plan not required to report measure,Plan not required to report measure,Plan too new to be measured,Plan too new to be measured,Plan too new to be measured,Plan too new to be measured,Plan too new to be measured,Plan too new to be measured,Plan too new to be measured,Plan too new to be measured,Plan too new to be measured,Plan too new to be measured,Plan too new to be measured,Plan too new to be measured,Plan too new to be measured,Plan too new to be measured,Plan too new to be measured,Plan too new to be measured,Plan too new to be measured,Plan too new to be measured,Plan too new to be measured,Plan too new to be measured,Plan too new to be measured,Plan too new to be measured,Plan too new to be measured,Plan too new to be measured,Plan too new to be measured,Plan too new to be measured,Plan too new to be measured,Plan too new to be measured,Plan too new to be measured,Plan too new to be measured,Plan too new to be measured,Plan too new to be measured,Plan too new to be measured,Plan too new to be measured,Plan too new to be measured,Plan too new to be measured
H6435,Demo,"ELDERSERVE HEALTH, INC.",RiverSpring FIDA Plan,Riverspring Health Holding Corp.,Plan too new to be measured,Plan too new to be measured,Plan too new to be measured,Plan too new to be measured,Plan too new to be measured,Plan too new to be measured,Plan too new to be measured,Plan not required to report measure,Plan not required to report measure,Plan not required to report measure,Plan not required to report measure,Plan too new to be measured,Plan too new to be measured,Plan too new to be measured,Plan too new to be measured,Plan too new to be measured,Plan too new to be measured,Plan too new to be measured,Plan too new to be measured,Plan too new to be measured,Plan too new to be measured,Plan too new to be measured,Plan too new to be measured,Plan too new to be measured,Plan too new to be measured,Plan too new to be measured,Plan too new to be measured,Plan too new to be measured,Plan too new to be measured,Plan too new to be measured,Plan too new to be measured,Not enough data available,Not enough data available,Plan too new to be measured,Plan too new to be measured,Plan too new to be measured,Plan too new to be measured,Plan too new to be measured,Plan too new to be measured,Plan too new to be measured,Plan too new to be measured,Plan too new to be measured,Plan too new to be measured,Plan too new to be measured,Plan too new to be measured,Plan too new to be measured,Plan too new to be measured
H6453,Local CCP,"HMO LOUISIANA, INC.",HMO Louisiana,Louisiana Health Service & Indemnity Company,Plan too new to be measured,Plan too new to be measured,Plan too new to be measured,Plan too new to be measured,Plan too new to be measured,Plan too new to be measured,Plan too new to be measured,Plan not required to report measure,Plan not required to report measure,Plan not required to report measure,Plan not required to report measure,Plan too new to be measured,Plan too new to be measured,Plan too new to be measured,Plan too new to be measured,Plan too new to be measured,Plan too new to be measured,Plan too new to be measured,Plan too new to be measured,Plan too new to be measured,Plan too new to be measured,Plan too new to be measured,Plan too new to be measured,Plan too new to be measured,Plan too new to be measured,Plan too new to be measured,Plan too new to be measured,Plan too new to be measured,Plan too new to be measured,Plan too new to be measured,Plan too new to be measured,Plan too new to be measured,Plan too new to be measured,Plan too new to be measured,Plan too new to be measured,Plan too new to be measured,Plan too new to be measured,Plan too new to be measured,Plan too new to be measured,Plan too new to be measured,Plan too new to be measured,Plan too new to be measured,Plan too new to be measured,Plan too new to be measured,Plan too new to be measured,Plan too new to be measured,Plan too new to be measured
H6528,Local CCP,CARE IMPROVEMENT PLUS SOUTH CENTRAL INSURANCE CO.,Care Improvement Plus,"UnitedHealth Group, Inc.",3,2,2,1,1,2,5,1,5,4,4,2,2,3,4,2,2,3,3,4,2,3,2,2,4,3,2,5,3,2,4,5,5,5,No data available,3,2,5,4,2,3,3,5,2,2,3,4
H6609,Local CCP,HUMANA INSURANCE COMPANY,Humana Insurance Company,Humana Inc.,3,3,5,3,3,3,4,Plan not required to report measure,Plan not required to report measure,Plan not required to report measure,Plan not required to report measure,2,3,3,4,4,3,2,4,4,4,4,4,4,5,5,5,3,3,4,5,5,5,5,4,5,5,3,3,4,3,3,4,4,5,5,2
H6622,Local CCP,HUMANA WI HEALTH ORGANIZATION INSURANCE CORP,Humana WI Health Organization Insurance Corp,Humana Inc.,4,4,4,4,4,3,5,No data available,Plan not required to report measure,Plan not required to report measure,Plan not required to report measure,2,3,4,5,5,5,2,4,4,5,4,4,4,5,4,5,3,3,Not enough data available,Not enough data available,5,5,5,Not enough data available,4,5,3,4,4,3,3,5,5,5,5,2
H6623,Local CCP,MARICOPA COUNTY SPECIAL HEALTH CARE DISTRICT,Maricopa Care Advantage,MARICOPA COUNTY SPECIAL HEALTH CARE DISTRICT,3,3,1,Plan too new to be measured,Plan too new to be measured,Plan too new to be measured,4,3,4,2,4,Not enough data available,3,3,4,3,Not enough data available,Plan too new to be measured,5,2,3,3,3,4,1,5,4,5,Not enough data available,Not enough data available,Not enough data available,2,2,3,Not enough data available,5,4,5,Not enough data available,4,3,4,5,2,2,3,2
H6723,Local CCP,MEDICAL MUTUAL OF OHIO,Medical Mutual of Ohio,MEDICAL MUTUAL OF OHIO,Plan too new to be measured,Plan too new to be measured,Plan too new to be measured,Plan too new to be measured,Plan too new to be measured,Plan too new to be measured,Plan too new to be measured,Plan not required to report measure,Plan not required to report measure,Plan not required to report measure,Plan not required to report measure,Plan too new to be measured,Plan too new to be measured,Plan too new to be measured,Plan too new to be measured,Plan too new to be measured,Plan too new to be measured,Plan too new to be measured,Plan too new to be measured,Plan too new to be measured,Plan too new to be measured,Plan too new to be measured,Plan too new to be measured,Plan too new to be measured,Plan too new to be measured,Plan too new to be measured,Plan too new to be measured,Plan too new to be measured,Plan too new to be measured,Plan too new to be measured,Plan too new to be measured,Plan too new to be measured,Plan too new to be measured,Plan too new to be measured,Plan too new to be measured,Plan too new to be measured,Plan too new to be measured,Plan too new to be measured,Plan too new to be measured,Plan too new to be measured,Plan too new to be measured,Plan too new to be measured,Plan too new to be measured,Plan too new to be measured,Plan too new to be measured,Plan too new to be measured,Plan too new to be measured
H6743,Local CCP,ATRIO HEALTH PLANS,ATRIO Health Plans,ATRIO Health Plans,3,2,3,2,2,2,3,Plan not required to report measure,Plan not required to report measure,Plan not required to report measure,Plan not required to report measure,2,2,2,4,3,5,2,4,3,3,5,2,4,2,5,5,4,2,4,1,2,2,5,Not enough data available,5,5,4,4,4,4,4,4,4,4,4,2
H6745,Local CCP,AMIDA CARE INC.,Amida Care,Amida Care Inc.,Plan too small to be measured,Plan too small to be measured,Plan too small to be measured,Plan too new to be measured,Plan too new to be measured,Plan too new to be measured,Plan too small to be measured,4,Plan not required to report measure,Plan not required to report measure,Plan not required to report measure,Plan too small to be measured,Plan too small to be measured,Plan too small to be measured,Plan too small to be measured,Plan too small to be measured,Plan too small to be measured,Plan too new to be measured,Plan too small to be measured,Plan too small to be measured,Plan too small to be measured,Plan too small to be measured,Plan too small to be measured,Plan too small to be measured,Plan too small to be measured,Not enough data available,Not enough data available,5,Not enough data available,Not enough data available,Not enough data available,5,5,Not enough data available,Not enough data available,Not enough data available,Not enough data available,5,Not enough data available,Plan too small to be measured,Plan too small to be measured,5,3,No data available,No data available,No data available,No data available
H6750,Local CCP,"HARVARD PILGRIM HEALTH CARE OF NEW ENGLAND, INC.","Harvard Pilgrim Health Care of New England, Inc.","Harvard Pilgrim Health Care, Inc.",Plan too small to be measured,Plan too small to be measured,Plan too small to be measured,Plan too new to be measured,Plan too new to be measured,Plan too new to be measured,Plan too small to be measured,Plan not required to report measure,Plan not required to report measure,Plan not required to report measure,Plan not required to report measure,Plan too small to be measured,Plan too small to be measured,Plan too small to be measured,Plan too small to be measured,Plan too small to be measured,Plan too small to be measured,Plan too new to be measured,Plan too small to be measured,Plan too small to be measured,Plan too small to be measured,Plan too small to be measured,Plan too small to be measured,Plan too small to be measured,Plan too small to be measured,Not enough data available,Not enough data available,5,Not enough data available,Not enough data available,Not enough data available,4,5,Not enough data available,Not enough data available,Not enough data available,Not enough data available,5,Not enough data available,Plan too small to be measured,Plan too small to be measured,4,3,No data available,5,5,No data available
H6751,Demo,"HEALTHSPRING OF TENNESSEE, INC.",Cigna-HealthSpring,CIGNA,Plan too new to be measured,Plan too new to be measured,Plan too new to be measured,Plan too new to be measured,Plan too new to be measured,Plan too new to be measured,Plan too new to be measured,Plan not required to report measure,Plan not required to report measure,Plan not required to report measure,Plan not required to report measure,Plan too new to be measured,Plan too new to be measured,Plan too new to be measured,Plan too new to be measured,Plan too new to be measured,Plan too new to be measured,Plan too new to be measured,Plan too new to be measured,Plan too new to be measured,Plan too new to be measured,Plan too new to be measured,Plan too new to be measured,Plan too new to be measured,Plan too new to be measured,Plan too new to be measured,Not enough data available,Plan too new to be measured,Plan too new to be measured,Plan too new to be measured,Plan too new to be measured,Not enough data available,Not enough data available,No data available,Plan too new to be measured,Plan too new to be measured,Not enough data available,Plan too new to be measured,Plan too new to be measured,Plan too new to be measured,Plan too new to be measured,No data available,No data available,No data available,No data available,No data available,No data available
H6776,Local CCP,"ELDERSERVE HEALTH, INC.",RiverSpring Star,Riverspring Health Holding Corp.,Plan too new to be measured,Plan too new to be measured,Plan too new to be measured,Plan too new to be measured,Plan too new to be measured,Plan too new to be measured,Plan too new to be measured,Plan too new to be measured,Plan too new to be measured,Plan too new to be measured,Plan too new to be measured,Plan too new to be measured,Plan too new to be measured,Plan too new to be measured,Plan too new to be measured,Plan too new to be measured,Plan too new to be measured,Plan too new to be measured,Plan too new to be measured,Plan too new to be measured,Plan too new to be measured,Plan too new to be measured,Plan too new to be measured,Plan too new to be measured,Plan too new to be measured,Plan too new to be measured,Plan too new to be measured,Plan too new to be measured,Plan too new to be measured,Plan too new to be measured,Plan too new to be measured,Plan too new to be measured,Plan too new to be measured,Plan too new to be measured,Plan too new to be measured,Plan too new to be measured,Plan too new to be measured,Plan too new to be measured,Plan too new to be measured,Plan too new to be measured,Plan too new to be measured,Plan too new to be measured,Plan too new to be measured,Plan too new to be measured,Plan too new to be measured,Plan too new to be measured,Plan too new to be measured
H6786,Local CCP,"ANTHEM HEALTH PLANS OF MAINE, INC.",Anthem Blue Cross and Blue Shield,Anthem Inc.,Plan too small to be measured,Plan too small to be measured,Plan too small to be measured,Plan too new to be measured,Plan too new to be measured,Plan too small to be measured,Plan too small to be measured,Plan not required to report measure,Plan not required to report measure,Plan not required to report measure,Plan not required to report measure,Plan too small to be measured,Plan too small to be measured,Plan too small to be measured,Plan too small to be measured,Plan too small to be measured,Plan too small to be measured,Plan too small to be measured,Plan too small to be measured,Plan too small to be measured,Plan too small to be measured,Plan too small to be measured,Plan too small to be measured,Plan too small to be measured,Plan too small to be measured,Not enough data available,Not enough data available,5,Not enough data available,Not enough data available,Not enough data available,5,5,Not enough data available,Not enough data available,Not enough data available,Not enough data available,5,3,Plan too small to be measured,Plan too small to be measured,3,4,5,5,5,No data available
H6801,Local CCP,"GHS MANAGED HEALTH CARE PLANS, INC.",Blue Cross Blue Shield of Oklahoma,Health Care Service Corporation,2,1,3,Plan too new to be measured,Plan too new to be measured,1,4,Plan not required to report measure,Plan not required to report measure,Plan not required to report measure,Plan not required to report measure,Not enough data available,1,3,3,3,2,1,3,3,3,1,2,2,3,2,4,4,2,5,1,5,5,5,Not enough data available,2,4,4,2,3,3,4,5,3,4,4,2
H6815,Local CCP,HEALTH NET HEALTH PLAN OF OREGON,"Health Net Health Plan of Oregon, Inc.","Health Net, Inc.",5,4,2,Plan too small to be measured,Plan too small to be measured,3,4,3,5,5,4,Not enough data available,4,4,5,4,5,2,4,4,4,3,3,3,3,4,5,4,2,5,2,5,5,5,No data available,4,5,4,4,2,3,4,5,5,5,5,2
H6859,Local CCP,"HUMANA MEDICAL PLAN OF PENNSYLVANIA, INC.","Humana Medical Plan of Pennsylvania, Inc.",Humana Inc.,Not enough data available,Not enough data available,2,Plan too new to be measured,Plan too new to be measured,Plan too new to be measured,Not enough data available,Plan not required to report measure,Plan not required to report measure,Plan not required to report measure,Plan not required to report measure,Not enough data available,1,No data available,4,3,Not enough data available,Plan too new to be measured,Plan not required to report measure,Not enough data available,4,Not enough data available,Not enough data available,2,Not enough data available,2,2,3,Not enough data available,Not enough data available,Not enough data available,5,5,5,Not enough data available,2,2,3,Not enough data available,Not enough data available,Not enough data available,3,5,5,5,4,2
H6864,Local CCP,"GUILDNET, INC.",GuildNet,Lighthouse Guild International,3,3,4,Plan too small to be measured,Plan too small to be measured,4,2,5,3,4,3,Not enough data available,2,No data available,2,2,Not enough data available,5,No data available,2,2,2,2,4,3,Not enough data available,Not enough data available,5,Not enough data available,Not enough data available,Not enough data available,2,2,Not enough data available,Not enough data available,Not enough data available,Not enough data available,5,3,3,3,3,3,4,5,5,3
H6870,Demo,"SUPERIOR HEALTH PLAN, INC.",Superior HealthPlan,Centene Corporation,Plan too new to be measured,Plan too new to be measured,Plan too new to be measured,Plan too new to be measured,Plan too new to be measured,Plan too new to be measured,Plan too new to be measured,Plan not required to report measure,Plan not required to report measure,Plan not required to report measure,Plan not required to report measure,Plan too new to be measured,Plan too new to be measured,Plan too new to be measured,Plan too new to be measured,Plan too new to be measured,Plan too new to be measured,Plan too new to be measured,Plan too new to be measured,Plan too new to be measured,Plan too new to be measured,Plan too new to be measured,Plan too new to be measured,Plan too new to be measured,Plan too new to be measured,Plan too new to be measured,Plan too new to be measured,Plan too new to be measured,Plan too new to be measured,Plan too new to be measured,Plan too new to be measured,Not enough data available,Not enough data available,Plan too new to be measured,Plan too new to be measured,Plan too new to be measured,Plan too new to be measured,Plan too new to be measured,Plan too new to be measured,Plan too new to be measured,Plan too new to be measured,Plan too new to be measured,Plan too new to be measured,Plan too new to be measured,Plan too new to be measured,Plan too new to be measured,Plan too new to be measured
H6947,Local CCP,QUALCHOICE ADVANTAGE,QualChoice Advantage,Catholic Health Initiatives,Plan too new to be measured,Plan too new to be measured,Plan too new to be measured,Plan too new to be measured,Plan too new to be measured,Plan too new to be measured,Plan too new to be measured,Plan not required to report measure,Plan not required to report measure,Plan not required to report measure,Plan not required to report measure,Plan too new to be measured,Plan too new to be measured,Plan too new to be measured,Plan too new to be measured,Plan too new to be measured,Plan too new to be measured,Plan too new to be measured,Plan too new to be measured,Plan too new to be measured,Plan too new to be measured,Plan too new to be measured,Plan too new to be measured,Plan too new to be measured,Plan too new to be measured,Plan too new to be measured,Plan too new to be measured,Plan too new to be measured,Plan too new to be measured,Plan too new to be measured,Plan too new to be measured,Plan too new to be measured,Plan too new to be measured,Plan too new to be measured,Plan too new to be measured,Plan too new to be measured,Plan too new to be measured,Plan too new to be measured,Plan too new to be measured,Plan too new to be measured,Plan too new to be measured,Plan too new to be measured,Plan too new to be measured,Plan too new to be measured,Plan too new to be measured,Plan too new to be measured,Plan too new to be measured
H6951,Local CCP,TRILLIUM COMMUNITY HEALTH PLAN,Trillium Advantage,"Agate Resources,  Inc.",Plan too small to be measured,Plan too small to be measured,Plan too small to be measured,Plan too new to be measured,Plan too new to be measured,Plan too new to be measured,Plan too small to be measured,Plan not required to report measure,Plan not required to report measure,Plan not required to report measure,Plan not required to report measure,Plan too small to be measured,Plan too small to be measured,Plan too small to be measured,Plan too small to be measured,Plan too small to be measured,Plan too small to be measured,Plan too new to be measured,Plan too small to be measured,Plan too small to be measured,Plan too small to be measured,Plan too small to be measured,Plan too small to be measured,Plan too small to be measured,Plan too small to be measured,Not enough data available,Not enough data available,5,Not enough data available,Not enough data available,Not enough data available,5,3,Not enough data available,Not enough data available,Not enough data available,Not enough data available,5,Not enough data available,Plan too small to be measured,Plan too small to be measured,4,4,No data available,No data available,No data available,No data available
