H2960,Local CCP,"HOMETOWN HEALTH PLAN, INC.",Senior Care Plus,Renown Health,4,4,4,4,3,3,5,Plan not required to report measure,Plan not required to report measure,Plan not required to report measure,Plan not required to report measure,1,3,3,4,4,3,1,3,4,4,5,4,5,3,4,5,4,2,5,2,5,4,3,Not enough data available,4,5,4,5,5,4,4,5,4,5,4,2
H2962,Local CCP,"ULTIMATE HEALTH PLANS, INC.",Ultimate Health Plans,"ULTIMATE HEALTH PLAN, INC.",Not enough data available,1,3,Plan too new to be measured,Plan too new to be measured,3,4,Plan not required to report measure,Plan not required to report measure,Plan not required to report measure,Plan not required to report measure,Not enough data available,3,4,4,2,2,1,2,4,3,5,4,5,3,3,3,5,Not enough data available,Not enough data available,Not enough data available,3,3,5,Not enough data available,3,3,5,3,5,5,2,5,5,5,5,2
H2968,Local CCP,MEMORIAL HERMANN HEALTH PLAN,Memorial Hermann Health Insurance Company,Memorial Hermann Healthcare System,Plan too new to be measured,Plan too new to be measured,Plan too new to be measured,Plan too new to be measured,Plan too new to be measured,Plan too new to be measured,Plan too new to be measured,Plan not required to report measure,Plan not required to report measure,Plan not required to report measure,Plan not required to report measure,Plan too new to be measured,Plan too new to be measured,Plan too new to be measured,Plan too new to be measured,Plan too new to be measured,Plan too new to be measured,Plan too new to be measured,Plan too new to be measured,Plan too new to be measured,Plan too new to be measured,Plan too new to be measured,Plan too new to be measured,Plan too new to be measured,Plan too new to be measured,Plan too new to be measured,Plan too new to be measured,Plan too new to be measured,Plan too new to be measured,Plan too new to be measured,Plan too new to be measured,5,5,Plan too new to be measured,Plan too new to be measured,Plan too new to be measured,Plan too new to be measured,Plan too new to be measured,Plan too new to be measured,Plan too new to be measured,Plan too new to be measured,Plan too new to be measured,Plan too new to be measured,Plan too new to be measured,Plan too new to be measured,Plan too new to be measured,Plan too new to be measured
H2986,Local CCP,STANFORD HEALTH CARE ADVANTAGE,Stanford Health Care Advantage,Stanford Health Care,Plan too new to be measured,Plan too new to be measured,Plan too new to be measured,Plan too new to be measured,Plan too new to be measured,Plan too new to be measured,Plan too new to be measured,Plan not required to report measure,Plan not required to report measure,Plan not required to report measure,Plan not required to report measure,Plan too new to be measured,Plan too new to be measured,Plan too new to be measured,Plan too new to be measured,Plan too new to be measured,Plan too new to be measured,Plan too new to be measured,Plan too new to be measured,Plan too new to be measured,Plan too new to be measured,Plan too new to be measured,Plan too new to be measured,Plan too new to be measured,Plan too new to be measured,Plan too new to be measured,Plan too new to be measured,Plan too new to be measured,Plan too new to be measured,Plan too new to be measured,Plan too new to be measured,5,5,Plan too new to be measured,Plan too new to be measured,Plan too new to be measured,Plan too new to be measured,Plan too new to be measured,Plan too new to be measured,Plan too new to be measured,Plan too new to be measured,Plan too new to be measured,Plan too new to be measured,Plan too new to be measured,Plan too new to be measured,Plan too new to be measured,Plan too new to be measured
H3018,Demo,"CENTERS PLAN FOR HEALTHY LIVING, LLC",Centers Plan for FIDA Care Complete,"Centers Plan for Healthy Living, LLC",Plan too new to be measured,Plan too new to be measured,Plan too new to be measured,Plan too new to be measured,Plan too new to be measured,Plan too new to be measured,Plan too new to be measured,Plan not required to report measure,Plan not required to report measure,Plan not required to report measure,Plan not required to report measure,Plan too new to be measured,Plan too new to be measured,Plan too new to be measured,Plan too new to be measured,Plan too new to be measured,Plan too new to be measured,Plan too new to be measured,Plan too new to be measured,Plan too new to be measured,Plan too new to be measured,Plan too new to be measured,Plan too new to be measured,Plan too new to be measured,Plan too new to be measured,Plan too new to be measured,Plan too new to be measured,Plan too new to be measured,Plan too new to be measured,Plan too new to be measured,Plan too new to be measured,Not enough data available,Not enough data available,Plan too new to be measured,Plan too new to be measured,Plan too new to be measured,Plan too new to be measured,Plan too new to be measured,Plan too new to be measured,Plan too new to be measured,Plan too new to be measured,Plan too new to be measured,Plan too new to be measured,Plan too new to be measured,Plan too new to be measured,Plan too new to be measured,Plan too new to be measured
H3054,Local CCP,"CONSTELLATION HEALTH, LLC.",Constellation Health,"Constellation Health, LLC.",Not enough data available,Not enough data available,1,Plan too new to be measured,Plan too new to be measured,Plan too new to be measured,Not enough data available,1,1,4,4,Not enough data available,2,4,1,1,Not enough data available,Plan too new to be measured,Plan not required to report measure,4,1,5,5,5,1,2,1,4,Not enough data available,Not enough data available,Not enough data available,3,3,3,Not enough data available,2,1,4,Not enough data available,5,4,3,4,2,2,2,5
H3067,Demo,"VIRGINIA PREMIER HEALTH PLAN, INC.",Virginia Premier CompleteCare,Virginia Cwlth University Hlth System Authority,Plan too new to be measured,Plan too new to be measured,Plan too new to be measured,Plan too new to be measured,Plan too new to be measured,Plan too new to be measured,Plan too new to be measured,Plan not required to report measure,Plan not required to report measure,Plan not required to report measure,Plan not required to report measure,Plan too new to be measured,Plan too new to be measured,Plan too new to be measured,Plan too new to be measured,Plan too new to be measured,Plan too new to be measured,Plan too new to be measured,Plan too new to be measured,Plan too new to be measured,Plan too new to be measured,Plan too new to be measured,Plan too new to be measured,Plan too new to be measured,Plan too new to be measured,Plan too new to be measured,Not enough data available,Plan too new to be measured,Plan too new to be measured,Plan too new to be measured,Plan too new to be measured,Not enough data available,Not enough data available,No data available,Plan too new to be measured,Plan too new to be measured,Not enough data available,Plan too new to be measured,Plan too new to be measured,Plan too new to be measured,Plan too new to be measured,No data available,No data available,No data available,No data available,No data available,No data available
H3071,Local CCP,"COMMUNITY CARE ALLIANCE OF ILLINOIS, NFP","Community Care Alliance of Illinois, NFP",Family Health Network,Not enough data available,Not enough data available,1,Plan too new to be measured,Plan too new to be measured,Plan too new to be measured,Not enough data available,1,Not enough data available,Not enough data available,Not enough data available,Not enough data available,No data available,No data available,2,1,Not enough data available,Plan too new to be measured,Plan not required to report measure,Not enough data available,3,2,2,1,3,Not enough data available,2,5,Not enough data available,Not enough data available,Not enough data available,3,3,Not enough data available,Not enough data available,Not enough data available,2,5,Not enough data available,2,Not enough data available,4,5,3,2,3,1
H3107,Local CCP,"OXFORD HEALTH PLANS (NJ), INC.",UnitedHealthcare,"UnitedHealth Group, Inc.",3,3,3,3,3,3,4,Plan not required to report measure,Plan not required to report measure,Plan not required to report measure,Plan not required to report measure,3,2,2,3,2,3,2,3,4,2,3,2,2,1,3,4,4,4,5,5,5,5,5,5,3,4,4,3,2,3,3,5,3,3,3,3
H3113,Local CCP,"OXFORD HEALTH PLANS (NJ), INC.",UnitedHealthcare,"UnitedHealth Group, Inc.",1,1,Plan too small to be measured,Not enough data available,Not enough data available,Not enough data available,Not enough data available,5,5,5,5,Not enough data available,5,3,5,Not enough data available,Not enough data available,Not enough data available,5,Plan too small to be measured,Plan too small to be measured,Plan too small to be measured,Plan too small to be measured,Plan too small to be measured,Plan too small to be measured,5,5,5,Not enough data available,Not enough data available,Not enough data available,5,5,5,Not enough data available,5,5,5,5,Plan too small to be measured,Plan too small to be measured,5,3,5,5,4,4
H3129,Demo,"NORTH SHORE-LIJ HEALTH PLAN, INC.","North Shore-LIJ Health Plan, Inc.","North Shore-LI Jewish Health System, Inc.",Plan too new to be measured,Plan too new to be measured,Plan too new to be measured,Plan too new to be measured,Plan too new to be measured,Plan too new to be measured,Plan too new to be measured,Plan not required to report measure,Plan not required to report measure,Plan not required to report measure,Plan not required to report measure,Plan too new to be measured,Plan too new to be measured,Plan too new to be measured,Plan too new to be measured,Plan too new to be measured,Plan too new to be measured,Plan too new to be measured,Plan too new to be measured,Plan too new to be measured,Plan too new to be measured,Plan too new to be measured,Plan too new to be measured,Plan too new to be measured,Plan too new to be measured,Plan too new to be measured,Plan too new to be measured,Plan too new to be measured,Plan too new to be measured,Plan too new to be measured,Plan too new to be measured,Not enough data available,Not enough data available,Plan too new to be measured,Plan too new to be measured,Plan too new to be measured,Plan too new to be measured,Plan too new to be measured,Plan too new to be measured,Plan too new to be measured,Plan too new to be measured,Plan too new to be measured,Plan too new to be measured,Plan too new to be measured,Plan too new to be measured,Plan too new to be measured,Plan too new to be measured
H3132,Local CCP,"AHF MCO OF FLORIDA, INC.",AHF,AIDS Healthcare Foundation,3,3,5,5,5,Not enough data available,4,1,5,5,5,Not enough data available,1,2,4,3,Not enough data available,Not enough data available,4,3,4,3,4,4,5,3,4,5,Not enough data available,Not enough data available,Not enough data available,3,3,5,No data available,3,4,5,5,5,3,4,5,5,5,5,3
H3152,Local CCP,"AETNA HEALTH, INC. (NJ)",Aetna Medicare,Aetna Inc.,3,4,4,4,2,2,3,Plan not required to report measure,Plan not required to report measure,Plan not required to report measure,Plan not required to report measure,3,3,2,4,4,3,3,3,4,3,4,4,4,4,4,5,2,3,3,4,5,5,5,5,4,5,2,4,1,4,4,3,4,5,4,3
H3154,Local CCP,"HORIZON HEALTHCARE OF NEW JERSEY, INC.",Horizon Blue Cross Blue Shield of New Jersey,"Horizon Healthcare Services, Inc.",3,2,3,4,5,2,4,Plan not required to report measure,Plan not required to report measure,Plan not required to report measure,Plan not required to report measure,1,3,3,4,4,5,3,3,3,3,4,3,1,3,3,5,4,4,4,2,3,2,3,4,3,5,4,3,2,3,4,4,4,5,4,3
H3156,Local CCP,"AMERIHEALTH HMO, INC.",AmeriHealth 65 Preferred HMO,"Independence Health Group, Inc.",4,3,3,5,5,2,3,Plan not required to report measure,Plan not required to report measure,Plan not required to report measure,Plan not required to report measure,Not enough data available,2,4,4,4,3,2,3,3,3,2,2,1,2,3,3,3,1,4,3,5,5,4,3,3,3,3,2,2,3,4,4,4,5,4,3
H3204,Local CCP,PRESBYTERIAN HEALTH PLAN,Presbyterian Senior Care (HMO),Presbyterian Healthcare Services,3,3,5,5,5,4,5,Plan not required to report measure,Plan not required to report measure,Plan not required to report measure,Plan not required to report measure,2,2,4,5,4,3,2,4,2,4,4,4,5,4,4,5,4,5,3,4,4,3,5,No data available,4,5,4,3,4,4,4,5,4,4,4,4
H3206,Local CCP,"PRESBYTERIAN INSURANCE COMPANY, INC.",Presbyterian MediCare PPO,Presbyterian Healthcare Services,4,3,4,2,4,3,3,Plan not required to report measure,Plan not required to report measure,Plan not required to report measure,Plan not required to report measure,1,3,3,4,4,4,2,4,2,3,3,3,4,1,5,5,4,2,3,3,4,3,5,No data available,5,5,4,4,3,3,4,5,4,5,4,5
H3233,Local CCP,PREMIER HEALTH INSURING CORPORATION,Premier Health Plan,Premier Health Partners,Plan too new to be measured,Plan too new to be measured,Plan too new to be measured,Plan too new to be measured,Plan too new to be measured,Plan too new to be measured,Plan too new to be measured,Plan too new to be measured,Plan too new to be measured,Plan too new to be measured,Plan too new to be measured,Plan too new to be measured,Plan too new to be measured,Plan too new to be measured,Plan too new to be measured,Plan too new to be measured,Plan too new to be measured,Plan too new to be measured,Plan too new to be measured,Plan too new to be measured,Plan too new to be measured,Plan too new to be measured,Plan too new to be measured,Plan too new to be measured,Plan too new to be measured,Plan too new to be measured,Plan too new to be measured,Plan too new to be measured,Plan too new to be measured,Plan too new to be measured,Plan too new to be measured,3,1,Plan too new to be measured,Plan too new to be measured,Plan too new to be measured,Plan too new to be measured,Plan too new to be measured,Plan too new to be measured,Plan too new to be measured,Plan too new to be measured,Plan too new to be measured,Plan too new to be measured,Plan too new to be measured,Plan too new to be measured,Plan too new to be measured,Plan too new to be measured
H3237,Demo,"HEALTH NET COMMUNITY SOLUTIONS, INC.",Health Net Cal MediConnect Medicare Medicaid Plan,"Health Net, Inc.",Plan too new to be measured,Plan too new to be measured,Plan too new to be measured,Plan too new to be measured,Plan too new to be measured,Plan too new to be measured,Plan too new to be measured,Plan not required to report measure,Plan not required to report measure,Plan not required to report measure,Plan not required to report measure,Plan too new to be measured,Plan too new to be measured,Plan too new to be measured,Plan too new to be measured,Plan too new to be measured,Plan too new to be measured,Plan too new to be measured,Plan too new to be measured,Plan too new to be measured,Plan too new to be measured,Plan too new to be measured,Plan too new to be measured,Plan too new to be measured,Plan too new to be measured,Plan too new to be measured,Not enough data available,Plan too new to be measured,Plan too new to be measured,Plan too new to be measured,Plan too new to be measured,Not enough data available,Not enough data available,No data available,Plan too new to be measured,Plan too new to be measured,Not enough data available,Plan too new to be measured,Plan too new to be measured,Plan too new to be measured,Plan too new to be measured,No data available,No data available,No data available,No data available,No data available,No data available
H3240,Local CCP,"AMERIGROUP NEW JERSEY, INC.",Amerigroup Community Care,Anthem Inc.,2,2,3,5,3,4,4,2,4,4,4,Not enough data available,3,3,3,3,1,5,2,Not enough data available,3,2,Not enough data available,2,Not enough data available,2,3,5,5,4,5,5,5,5,Not enough data available,2,3,5,5,3,Not enough data available,4,4,4,3,3,2
H3251,Local CCP,HEALTH CARE SERVICE CORPORATION,Lovelace Medicare Plan,Health Care Service Corporation,3,2,4,2,4,4,1,Plan not required to report measure,Plan not required to report measure,Plan not required to report measure,Plan not required to report measure,2,2,2,1,2,3,4,4,2,2,1,1,1,1,4,4,4,1,3,1,5,5,5,Not enough data available,4,4,4,4,3,4,4,5,4,4,4,1
H3259,Local CCP,VOLUNTEER STATE HEALTH PLAN,BlueCare Plus Tennessee,BlueCross BlueShield of Tennessee,Not enough data available,Not enough data available,2,Plan too new to be measured,Plan too new to be measured,Plan too new to be measured,Not enough data available,4,4,1,3,Not enough data available,3,4,2,3,Not enough data available,Plan too new to be measured,Plan not required to report measure,4,4,4,3,5,3,3,4,5,Not enough data available,Not enough data available,Not enough data available,2,2,3,Not enough data available,3,4,5,Not enough data available,5,4,4,2,3,3,4,2
H3291,Local CCP,"PRUITTHEALTH PREMIER, INC.",PruittHealth Premier (HMO SNP),"UNICO Premier, LLC",Plan too new to be measured,Plan too new to be measured,Plan too new to be measured,Plan too new to be measured,Plan too new to be measured,Plan too new to be measured,Plan too new to be measured,Plan too new to be measured,Plan too new to be measured,Plan too new to be measured,Plan too new to be measured,Plan too new to be measured,Plan too new to be measured,Plan too new to be measured,Plan too new to be measured,Plan too new to be measured,Plan too new to be measured,Plan too new to be measured,Plan too new to be measured,Plan too new to be measured,Plan too new to be measured,Plan too new to be measured,Plan too new to be measured,Plan too new to be measured,Plan too new to be measured,Plan too new to be measured,Plan too new to be measured,Plan too new to be measured,Plan too new to be measured,Plan too new to be measured,Plan too new to be measured,Plan too new to be measured,Plan too new to be measured,Plan too new to be measured,Plan too new to be measured,Plan too new to be measured,Plan too new to be measured,Plan too new to be measured,Plan too new to be measured,Plan too new to be measured,Plan too new to be measured,Plan too new to be measured,Plan too new to be measured,Plan too new to be measured,Plan too new to be measured,Plan too new to be measured,Plan too new to be measured
H3305,Local CCP,"MVP HEALTH PLAN, INC.",MVP HEALTH CARE,"MVP Health Care, Inc.",4,4,5,2,4,4,5,Plan not required to report measure,Plan not required to report measure,Plan not required to report measure,Plan not required to report measure,1,5,3,5,5,4,2,3,5,5,5,5,4,5,5,4,5,4,5,4,5,5,5,5,5,4,5,4,5,4,3,3,5,5,5,2
H3307,Local CCP,"OXFORD HEALTH PLANS (NY), INC.",UnitedHealthcare,"UnitedHealth Group, Inc.",3,3,4,5,2,2,2,Plan not required to report measure,Plan not required to report measure,Plan not required to report measure,Plan not required to report measure,3,3,2,4,2,3,2,3,2,1,4,1,2,2,4,5,5,5,5,5,5,5,5,4,4,5,5,4,2,3,4,5,4,4,3,2
H3312,Local CCP,"AETNA HEALTH, INC. (NY)",Aetna Medicare,Aetna Inc.,4,3,4,3,3,3,4,Plan not required to report measure,Plan not required to report measure,Plan not required to report measure,Plan not required to report measure,3,4,3,4,4,3,3,4,4,2,4,3,3,2,3,3,2,5,3,4,5,5,5,No data available,3,3,2,3,1,2,4,4,4,5,4,3
H3314,1876 Cost,HEALTH INSURANCE PLAN OF GREATER NEW YORK,HIP Health Plan of Greater New York,"EmblemHealth, Inc.",Plan too small to be measured,Plan too small to be measured,Plan too small to be measured,Not enough data available,Not enough data available,Plan too small to be measured,Plan too small to be measured,Plan not required to report measure,Plan not required to report measure,Plan not required to report measure,Plan not required to report measure,Plan too small to be measured,Plan too small to be measured,Plan too small to be measured,Plan too small to be measured,Plan too small to be measured,Plan too small to be measured,Plan too small to be measured,Plan too small to be measured,Plan too small to be measured,Plan too small to be measured,Plan too small to be measured,Plan too small to be measured,Plan too small to be measured,Plan too small to be measured,Not enough data available,Not enough data available,5,Not enough data available,Not enough data available,Not enough data available,Plan not required to report measure,Plan not required to report measure,Plan not required to report measure,Plan not required to report measure,Plan not required to report measure,Plan not required to report measure,Plan not required to report measure,Plan not required to report measure,Plan not required to report measure,Plan not required to report measure,Plan not required to report measure,Plan not required to report measure,Plan not required to report measure,Plan not required to report measure,Plan not required to report measure,Plan not required to report measure
H3327,Local CCP,"TOUCHSTONE HEALTH HMO, INC.",Touchstone Health,"Touchstone Health Partnership, Inc",2,2,1,5,4,2,3,3,2,4,4,2,3,3,3,2,2,4,3,2,1,2,1,1,3,3,2,5,3,3,1,4,3,5,Not enough data available,3,2,5,2,1,1,4,3,3,2,3,1
H3328,Local CCP,"THE NEW YORK STATE CATHOLIC HEALTH PLAN, INC.",Fidelis Care,"The New York State Catholic Health Plan, Inc.",4,3,2,4,3,3,5,1,5,4,4,4,4,3,4,4,5,4,3,3,2,3,3,3,5,3,5,5,5,3,3,4,5,5,4,3,5,5,5,4,3,4,5,4,4,3,2
H3330,Local CCP,HEALTH INSURANCE PLAN OF GREATER NEW YORK,EmblemHealth Medicare HMO,"EmblemHealth, Inc.",4,4,3,5,3,3,5,2,4,3,3,4,4,3,4,3,3,3,2,1,1,2,1,2,2,4,5,5,2,4,2,4,5,5,2,4,5,5,1,3,3,3,5,4,4,3,4
H3335,Local CCP,"EXCELLUS HEALTH PLAN, INC.","Excellus Health Plan, Inc","Lifetime Healthcare, Inc.",4,3,4,4,3,3,4,Plan not required to report measure,Plan not required to report measure,Plan not required to report measure,Plan not required to report measure,1,3,3,4,5,4,2,4,4,3,5,4,2,4,5,5,2,5,5,2,5,4,5,1,5,5,2,4,4,5,4,4,5,5,5,1
H3337,Local CCP,"LIBERTY HEALTH ADVANTAGE, INC.",Liberty Health Advantage,"Liberty Health Advantage, Inc.",3,4,1,5,3,3,4,3,3,4,4,Not enough data available,3,3,4,3,Not enough data available,4,3,1,1,3,1,2,1,3,2,4,5,3,2,5,4,5,Not enough data available,3,2,4,3,3,2,4,4,2,2,2,1
H3342,Local CCP,"EMPIRE HEALTHCHOICE ASSURANCE, INC.",Empire BlueCross BlueShield,Anthem Inc.,3,3,3,4,3,2,3,Plan not required to report measure,Plan not required to report measure,Plan not required to report measure,Plan not required to report measure,3,2,3,4,3,2,2,2,3,1,2,3,1,2,3,5,5,1,4,4,5,5,4,4,3,5,5,4,1,2,4,5,4,5,4,2
H3344,Local CCP,INDEPENDENT HEALTH BENEFITS CORPORATION,Independent Health,"Independent Health Association, Inc.",4,3,5,5,5,3,4,Plan not required to report measure,Plan not required to report measure,Plan not required to report measure,Plan not required to report measure,2,4,4,4,4,5,3,4,4,4,5,5,5,2,4,5,3,3,Not enough data available,Not enough data available,5,4,4,Not enough data available,4,5,3,5,5,5,2,4,4,5,5,2
H3347,Local CCP,"ELDERPLAN, INC.",Elderplan,"Elderplan, Inc.",2,2,2,5,2,3,3,4,3,5,4,1,2,4,3,2,2,4,3,1,1,1,1,1,3,3,3,4,3,4,3,5,5,5,Not enough data available,3,3,4,3,1,1,3,4,3,2,3,2
H3351,Local CCP,"EXCELLUS HEALTH PLAN, INC.","Excellus Health Plan, Inc","Lifetime Healthcare, Inc.",5,4,5,2,2,4,5,Plan not required to report measure,Plan not required to report measure,Plan not required to report measure,Plan not required to report measure,1,4,3,5,4,4,2,4,4,5,5,4,3,3,5,4,2,3,5,3,5,4,5,2,5,4,2,4,4,5,3,3,5,5,5,1
H3359,Local CCP,"MANAGED HEALTH, INC.",Healthfirst Medicare Plan,"Healthfirst, Inc.",5,4,3,5,5,5,4,1,5,3,4,4,4,4,4,3,3,5,3,2,2,3,2,4,2,5,5,5,3,4,5,5,3,5,4,5,5,5,5,4,2,4,5,4,3,3,2
H3361,Local CCP,"WELLCARE OF NEW YORK, INC.",WellCare,"WellCare Health Plans, Inc.",3,3,2,4,3,3,3,1,3,3,4,1,3,4,3,2,2,4,2,2,2,2,2,1,3,3,3,1,3,3,5,3,3,4,3,3,3,1,3,2,2,4,4,3,3,3,1
H3362,Local CCP,"INDEPENDENT HEALTH ASSOCIATION, INC.",Independent Health,"Independent Health Association, Inc.",4,4,4,3,4,3,4,4,5,4,4,1,3,4,5,4,3,2,4,5,5,5,5,5,3,5,5,3,4,4,4,5,4,4,3,5,5,3,5,5,5,2,4,5,5,4,2
H3370,Local CCP,"EMPIRE HEALTHCHOICE HMO, INC.",Empire BlueCross BlueShield,Anthem Inc.,3,3,3,5,4,2,4,No data available,Plan not required to report measure,Plan not required to report measure,Plan not required to report measure,3,3,2,4,3,3,3,2,4,2,2,3,1,3,3,5,5,2,4,4,5,5,5,4,3,5,5,5,1,2,4,5,4,5,4,2
H3379,Local CCP,"UNITEDHEALTHCARE OF NEW YORK, INC.",UnitedHealthcare,"UnitedHealth Group, Inc.",2,2,2,4,4,2,3,5,5,5,5,2,3,3,4,2,3,4,3,2,1,2,1,1,2,3,4,5,5,5,5,5,5,5,No data available,3,4,5,1,1,1,4,5,4,4,3,3
H3384,Local CCP,HEALTHNOW NEW YORK INC.,BCBS of WNY/BS of NENY/HealthNow New York Inc.,HealthNow New York Inc.,4,4,5,4,3,2,5,Plan not required to report measure,Plan not required to report measure,Plan not required to report measure,Plan not required to report measure,1,4,4,5,4,3,2,2,4,4,3,4,2,3,5,2,5,2,4,3,4,5,5,4,5,2,5,4,2,5,4,3,5,5,5,1
H3387,Local CCP,"UNITEDHEALTHCARE OF NEW YORK, INC.",UnitedHealthcare Community Plan,"UnitedHealth Group, Inc.",4,3,3,4,5,4,4,1,3,3,3,Not enough data available,4,4,4,3,2,4,3,2,1,3,1,2,2,3,2,5,5,3,4,5,5,5,Not enough data available,3,2,5,5,2,Not enough data available,4,5,4,4,4,2
H3388,Local CCP,"CAPITAL DISTRICT PHYSICIANS' HEALTH PLAN, INC.",CDPHP Medicare Choices,"Capital District Physicians' Health Plan, Inc.",4,4,5,4,3,3,5,Plan not required to report measure,Plan not required to report measure,Plan not required to report measure,Plan not required to report measure,2,5,4,5,4,5,2,3,5,5,5,5,5,4,5,5,5,3,4,2,5,4,1,1,5,5,5,4,5,4,4,5,4,5,5,2
H3404,Local CCP,BLUE CROSS AND BLUE SHIELD OF NORTH CAROLINA,Blue Cross and Blue Shield of North Carolina,Blue Cross and Blue Shield of North Carolina,4,2,3,5,5,4,2,Plan not required to report measure,Plan not required to report measure,Plan not required to report measure,Plan not required to report measure,1,3,3,4,3,4,3,4,3,3,Not enough data available,3,2,4,4,4,3,1,4,4,3,3,4,5,4,4,3,4,3,3,4,3,4,5,4,2
H3421,PFFS,"AMERICA'S 1ST CHOICE HEALTH PLANS, INC.","America's 1st Choice Health Plans, Inc.","America's 1st Choice Holdings of S.C., LLC",3,2,3,2,1,2,4,Plan not required to report measure,Plan not required to report measure,Plan not required to report measure,Plan not required to report measure,Not enough data available,2,2,4,3,Not enough data available,2,3,4,3,4,4,3,5,4,3,5,5,Not enough data available,Not enough data available,5,5,5,Not enough data available,4,3,5,3,3,4,4,2,4,3,3,3
