2016 Star View: Medicare Report Card Master Table,,,,,,,,,,,,,,,,,,,,,,,,,,,,,,,,,,,,,,,,,,,,,,,,,,,
CONTRACT_ID,Organization Type,Contract Name,Organization Marketing Name,Parent Organization,"HD1: Staying Healthy: Screenings, Tests and Vaccines",,,,,,,HD2: Managing Chronic (Long Term) Conditions,,,,,,,,,,,,HD3: Member Experience with Health Plan,,,,,,HD4: Member Complaints and Changes in the Health Plan's Performance,,,,HD5: Health Plan Customer Service,,,DD1: Drug Plan Customer Service,,,DD2: Member Complaints and Changes in the Drug Plan’s Performance,,,,DD3: Member Experience with the Drug Plan,,DD4: Drug Safety and Accuracy of Drug Pricing,,,,,
,,,,,C01: Breast Cancer Screening,C02: Colorectal Cancer Screening,C03: Annual Flu Vaccine,C04: Improving or Maintaining Physical Health,C05: Improving or Maintaining Mental Health,C06: Monitoring Physical Activity,C07: Adult BMI Assessment,C08: Special Needs Plan (SNP) Care Management,C09: Care for Older Adults – Medication Review,C10: Care for Older Adults – Functional Status Assessment,C11: Care for Older Adults – Pain Assessment,C12: Osteoporosis Management in Women who had a Fracture,C13: Diabetes Care – Eye Exam,C14: Diabetes Care – Kidney Disease Monitoring,C15: Diabetes Care – Blood Sugar Controlled,C16: Controlling Blood Pressure,C17: Rheumatoid Arthritis Management,C18: Reducing the Risk of Falling,C19: Plan All-Cause Readmissions,C20: Getting Needed Care,C21: Getting Appointments and Care Quickly,C22: Customer Service,C23: Rating of Health Care Quality,C24: Rating of Health Plan,C25: Care Coordination,C26: Complaints about the Health Plan,C27: Members Choosing to Leave the Plan,C28: Beneficiary Access and Performance Problems,C29: Health Plan Quality Improvement,C30: Plan Makes Timely Decisions about Appeals,C31: Reviewing Appeals Decisions,C32: Call Center – Foreign Language Interpreter and TTY Availability,D01: Call Center – Foreign Language Interpreter and TTY Availability,D02: Appeals Auto–Forward,D03: Appeals Upheld,D04: Complaints about the Drug Plan,D05: Members Choosing to Leave the Plan,D06: Beneficiary Access and Performance Problems,D07: Drug Plan Quality Improvement,D08: Rating of Drug Plan,D09: Getting Needed Prescription Drugs,D10: MPF Price Accuracy,D11: High Risk Medication,D12: Medication Adherence for Diabetes Medications,D13: Medication Adherence for Hypertension (RAS antagonists),D14: Medication Adherence for Cholesterol (Statins),D15: MTM Program Completion Rate for CMR
,,,,,01/01/2014 - 12/31/2014,01/01/2014 - 12/31/2014,02/15/2015 - 05/31/2015,04/18/2014 - 07/31/2014,04/18/2014 - 07/31/2014,04/18/2014 - 07/31/2014,01/01/2014 - 12/31/2014,01/01/2014 - 12/31/2014,01/01/2014 - 12/31/2014,01/01/2014 - 12/31/2014,01/01/2014 - 12/31/2014,01/01/2014 - 12/31/2014,01/01/2014 - 12/31/2014,01/01/2014 - 12/31/2014,01/01/2014 - 12/31/2014,01/01/2014 - 12/31/2014,01/01/2014 - 12/31/2014,04/18/2014 - 07/31/2014,01/01/2014 - 12/31/2014,02/15/2015 - 05/31/2015,02/15/2015 - 05/31/2015,02/15/2015 - 05/31/2015,02/15/2015 - 05/31/2015,02/15/2015 - 05/31/2015,02/15/2015 - 05/31/2015,01/01/2014 - 12/31/2014,01/01/2014 - 12/31/2014,01/01/2014 - 12/31/2014,Not Applicable,01/01/2014 - 12/31/2014,01/01/2014 - 12/31/2014,03/23/2015 - 06/05/2015,03/23/2015 - 06/05/2015,01/01/2014 - 12/31/2014,01/01/2014 - 12/31/2014,01/01/2014 - 12/31/2014,01/01/2014 - 12/31/2014,01/01/2014 - 12/31/2014,Not Applicable,02/15/2015 - 05/31/2015,02/15/2015 - 05/31/2015,01/01/2014 - 09/30/2014,01/01/2014 - 12/31/2014,01/01/2014 - 12/31/2014,01/01/2014 - 12/31/2014,01/01/2014 - 12/31/2014,01/01/2014 - 12/31/2014
E0654,Employer/Union Only Direct Contract PDP,IBT VOLUNTARY EMPLOYEE BENEFITS TRUST,TEAMStar Medicare Part D Prescription Drug Program,IBT Voluntary Employee Benefits Trust,Plan not required to report measure,Plan not required to report measure,Plan not required to report measure,Plan not required to report measure,Plan not required to report measure,Plan not required to report measure,Plan not required to report measure,Plan not required to report measure,Plan not required to report measure,Plan not required to report measure,Plan not required to report measure,Plan not required to report measure,Plan not required to report measure,Plan not required to report measure,Plan not required to report measure,Plan not required to report measure,Plan not required to report measure,Plan not required to report measure,Plan not required to report measure,Plan not required to report measure,Plan not required to report measure,Plan not required to report measure,Plan not required to report measure,Plan not required to report measure,Plan not required to report measure,Plan not required to report measure,Plan not required to report measure,Plan not required to report measure,Plan not required to report measure,Plan not required to report measure,Plan not required to report measure,Plan not required to report measure,Not enough data available,5,No data available,4,Not enough data available,5,4,4,5,Not enough data available,2,3,4,4,1
E2630,Employer/Union Only Direct Contract PDP,C AND O EMPLOYEES' HOSPITAL ASSOCIATION,C and O Employees Hospital Association,C & O Employees' Hospital Association,Plan not required to report measure,Plan not required to report measure,Plan not required to report measure,Plan not required to report measure,Plan not required to report measure,Plan not required to report measure,Plan not required to report measure,Plan not required to report measure,Plan not required to report measure,Plan not required to report measure,Plan not required to report measure,Plan not required to report measure,Plan not required to report measure,Plan not required to report measure,Plan not required to report measure,Plan not required to report measure,Plan not required to report measure,Plan not required to report measure,Plan not required to report measure,Plan not required to report measure,Plan not required to report measure,Plan not required to report measure,Plan not required to report measure,Plan not required to report measure,Plan not required to report measure,Plan not required to report measure,Plan not required to report measure,Plan not required to report measure,Plan not required to report measure,Plan not required to report measure,Plan not required to report measure,Plan not required to report measure,Not enough data available,5,Not enough data available,5,Not enough data available,5,5,5,5,Not enough data available,4,4,3,4,3
E3014,Employer/Union Only Direct Contract PDP,PSERS HOP PROGRAM,Pennsylvania Public School Employees Retirement Sy,Commonwealth of PA Pub Schools Retirement System,Plan not required to report measure,Plan not required to report measure,Plan not required to report measure,Plan not required to report measure,Plan not required to report measure,Plan not required to report measure,Plan not required to report measure,Plan not required to report measure,Plan not required to report measure,Plan not required to report measure,Plan not required to report measure,Plan not required to report measure,Plan not required to report measure,Plan not required to report measure,Plan not required to report measure,Plan not required to report measure,Plan not required to report measure,Plan not required to report measure,Plan not required to report measure,Plan not required to report measure,Plan not required to report measure,Plan not required to report measure,Plan not required to report measure,Plan not required to report measure,Plan not required to report measure,Plan not required to report measure,Plan not required to report measure,Plan not required to report measure,Plan not required to report measure,Plan not required to report measure,Plan not required to report measure,Plan not required to report measure,Not enough data available,5,4,5,Not enough data available,5,4,5,5,Not enough data available,4,3,5,4,1
E4744,Employer/Union Only Direct Contract PDP,MODOT/MSHP MEDICAL AND LIFE INSURANCE PLAN,MISSOURI DEPARTMENT OF TRANSPORTATION,Missouri Highways and Transportation Commission,Plan not required to report measure,Plan not required to report measure,Plan not required to report measure,Plan not required to report measure,Plan not required to report measure,Plan not required to report measure,Plan not required to report measure,Plan not required to report measure,Plan not required to report measure,Plan not required to report measure,Plan not required to report measure,Plan not required to report measure,Plan not required to report measure,Plan not required to report measure,Plan not required to report measure,Plan not required to report measure,Plan not required to report measure,Plan not required to report measure,Plan not required to report measure,Plan not required to report measure,Plan not required to report measure,Plan not required to report measure,Plan not required to report measure,Plan not required to report measure,Plan not required to report measure,Plan not required to report measure,Plan not required to report measure,Plan not required to report measure,Plan not required to report measure,Plan not required to report measure,Plan not required to report measure,Plan not required to report measure,Not enough data available,5,No data available,5,Not enough data available,4,4,4,5,Not enough data available,3,4,4,4,1
E7316,Employer/Union Only Direct Contract PDP,UNION PACIFIC RAILROAD EMPLOYES HEALTH SYSTEMS,Union Pacific Railroad  Employes Health Systems,Union Pacific Railroad Employes Health Systems,Plan not required to report measure,Plan not required to report measure,Plan not required to report measure,Plan not required to report measure,Plan not required to report measure,Plan not required to report measure,Plan not required to report measure,Plan not required to report measure,Plan not required to report measure,Plan not required to report measure,Plan not required to report measure,Plan not required to report measure,Plan not required to report measure,Plan not required to report measure,Plan not required to report measure,Plan not required to report measure,Plan not required to report measure,Plan not required to report measure,Plan not required to report measure,Plan not required to report measure,Plan not required to report measure,Plan not required to report measure,Plan not required to report measure,Plan not required to report measure,Plan not required to report measure,Plan not required to report measure,Plan not required to report measure,Plan not required to report measure,Plan not required to report measure,Plan not required to report measure,Plan not required to report measure,Plan not required to report measure,Not enough data available,5,Not enough data available,4,Not enough data available,5,4,5,2,Not enough data available,2,1,2,3,5
H0022,Demo,"BUCKEYE COMMUNITY HEALTH PLAN, INC.",Buckeye Health Plan - MyCare Ohio,Centene Corporation,Plan too new to be measured,Plan too new to be measured,Plan too new to be measured,Plan too new to be measured,Plan too new to be measured,Plan too new to be measured,Plan too new to be measured,Plan not required to report measure,Plan not required to report measure,Plan not required to report measure,Plan not required to report measure,Plan too new to be measured,Plan too new to be measured,Plan too new to be measured,Plan too new to be measured,Plan too new to be measured,Plan too new to be measured,Plan too new to be measured,Plan too new to be measured,Plan too new to be measured,Plan too new to be measured,Plan too new to be measured,Plan too new to be measured,Plan too new to be measured,Plan too new to be measured,Plan too new to be measured,Not enough data available,Plan too new to be measured,Plan too new to be measured,Plan too new to be measured,Plan too new to be measured,Not enough data available,Not enough data available,No data available,Plan too new to be measured,Plan too new to be measured,Not enough data available,Plan too new to be measured,Plan too new to be measured,Plan too new to be measured,Plan too new to be measured,No data available,No data available,No data available,No data available,No data available,No data available
H0028,Local CCP,"CHA HMO, INC.","CHA HMO, Inc.",Humana Inc.,Not enough data available,4,4,Plan too new to be measured,Plan too new to be measured,3,4,Plan not required to report measure,Plan not required to report measure,Plan not required to report measure,Plan not required to report measure,Not enough data available,3,4,4,5,2,2,3,Not enough data available,3,Not enough data available,4,4,5,2,4,3,5,Not enough data available,Not enough data available,5,5,5,Not enough data available,2,4,3,3,4,Not enough data available,3,5,4,5,5,2
H0104,Local CCP,BLUE CROSS AND BLUE SHIELD OF ALABAMA,Blue Advantage (PPO),BlueCross BlueShield of Alabama,4,4,3,3,3,2,4,Plan not required to report measure,Plan not required to report measure,Plan not required to report measure,Plan not required to report measure,3,3,3,4,3,3,2,4,5,3,4,5,5,4,4,5,4,5,4,3,5,5,3,3,4,5,4,4,4,5,4,3,4,5,4,2
H0107,Local CCP,HEALTH CARE SERVICE CORPORATION,Blue Cross and Blue Shield of Montana,Health Care Service Corporation,Plan too small to be measured,Plan too small to be measured,Plan too small to be measured,Plan too new to be measured,Plan too new to be measured,Plan too new to be measured,Plan too small to be measured,Plan not required to report measure,Plan not required to report measure,Plan not required to report measure,Plan not required to report measure,Plan too small to be measured,Plan too small to be measured,Plan too small to be measured,Plan too small to be measured,Plan too small to be measured,Plan too small to be measured,Plan too new to be measured,Plan too small to be measured,Plan too small to be measured,Plan too small to be measured,Plan too small to be measured,Plan too small to be measured,Plan too small to be measured,Plan too small to be measured,Not enough data available,Not enough data available,5,Not enough data available,Not enough data available,Not enough data available,5,5,Not enough data available,Not enough data available,Not enough data available,Not enough data available,5,Not enough data available,Plan too small to be measured,Plan too small to be measured,Not enough data available,5,No data available,4,4,No data available
H0137,Demo,"COMMONWEALTH CARE ALLIANCE, INC.","Commonwealth Care Alliance, Inc.","Commonwealth Care Alliance, Inc.",No data available,No data available,Plan too small to be measured,Plan too new to be measured,Plan too new to be measured,Plan too new to be measured,No data available,Plan not required to report measure,Plan not required to report measure,Plan not required to report measure,Plan not required to report measure,No data available,No data available,No data available,No data available,No data available,No data available,Plan too new to be measured,Plan not required to report measure,Plan too small to be measured,Plan too small to be measured,Plan too small to be measured,Plan too small to be measured,Plan too small to be measured,Plan too small to be measured,No data available,Not enough data available,Not enough data available,Not enough data available,Not enough data available,Not enough data available,Not enough data available,Not enough data available,No data available,No data available,No data available,Not enough data available,Not enough data available,Not enough data available,Plan too small to be measured,Plan too small to be measured,No data available,No data available,No data available,No data available,No data available,No data available
H0141,Local CCP,"MCLAREN HEALTH PLAN, INC.",McLaren Advantage,McLaren Health Care Corporation,Not enough data available,Not enough data available,Plan too small to be measured,Not enough data available,Not enough data available,Not enough data available,Not enough data available,Plan not required to report measure,Plan not required to report measure,Plan not required to report measure,Plan not required to report measure,Not enough data available,Not enough data available,Not enough data available,Not enough data available,Not enough data available,Not enough data available,Not enough data available,Plan not required to report measure,Plan too small to be measured,Plan too small to be measured,Plan too small to be measured,Plan too small to be measured,Plan too small to be measured,Plan too small to be measured,Not enough data available,Not enough data available,4,Not enough data available,Not enough data available,Not enough data available,5,5,Not enough data available,Not enough data available,Not enough data available,Not enough data available,4,3,Plan too small to be measured,Plan too small to be measured,4,3,3,3,4,No data available
H0147,Demo,"HEALTHKEEPERS, INC.",Anthem HealthKeepers,Anthem Inc.,Plan too new to be measured,Plan too new to be measured,Plan too new to be measured,Plan too new to be measured,Plan too new to be measured,Plan too new to be measured,Plan too new to be measured,Plan not required to report measure,Plan not required to report measure,Plan not required to report measure,Plan not required to report measure,Plan too new to be measured,Plan too new to be measured,Plan too new to be measured,Plan too new to be measured,Plan too new to be measured,Plan too new to be measured,Plan too new to be measured,Plan too new to be measured,Plan too new to be measured,Plan too new to be measured,Plan too new to be measured,Plan too new to be measured,Plan too new to be measured,Plan too new to be measured,Plan too new to be measured,Not enough data available,Plan too new to be measured,Plan too new to be measured,Plan too new to be measured,Plan too new to be measured,Not enough data available,Not enough data available,No data available,Plan too new to be measured,Plan too new to be measured,Not enough data available,Plan too new to be measured,Plan too new to be measured,Plan too new to be measured,Plan too new to be measured,No data available,No data available,No data available,No data available,No data available,No data available
H0148,Demo,CARE1ST HEALTH PLAN,Care1st Health Plan,Care1st Health Plan,Plan too new to be measured,Plan too new to be measured,Plan too new to be measured,Plan too new to be measured,Plan too new to be measured,Plan too new to be measured,Plan too new to be measured,Plan not required to report measure,Plan not required to report measure,Plan not required to report measure,Plan not required to report measure,Plan too new to be measured,Plan too new to be measured,Plan too new to be measured,Plan too new to be measured,Plan too new to be measured,Plan too new to be measured,Plan too new to be measured,Plan too new to be measured,Plan too new to be measured,Plan too new to be measured,Plan too new to be measured,Plan too new to be measured,Plan too new to be measured,Plan too new to be measured,Plan too new to be measured,Not enough data available,Plan too new to be measured,Plan too new to be measured,Plan too new to be measured,Plan too new to be measured,Not enough data available,Not enough data available,No data available,Plan too new to be measured,Plan too new to be measured,Not enough data available,Plan too new to be measured,Plan too new to be measured,Plan too new to be measured,Plan too new to be measured,No data available,No data available,No data available,No data available,No data available,No data available
H0150,Local CCP,"HEALTHSPRING OF ALABAMA, INC.",Cigna-HealthSpring,CIGNA,5,5,2,3,2,2,5,3,5,4,4,5,4,4,5,3,2,3,3,4,2,4,4,5,3,4,5,4,3,4,4,5,5,5,Not enough data available,4,5,4,5,4,5,4,5,3,3,3,3
H0151,Local CCP,"UNITEDHEALTHCARE OF ALABAMA, INC.",UnitedHealthcare,"UnitedHealth Group, Inc.",3,3,2,4,2,1,5,1,5,4,5,3,2,3,4,3,3,3,3,3,1,4,1,4,2,4,3,5,3,5,5,5,5,5,Not enough data available,4,3,5,4,4,4,3,4,3,3,3,3
H0154,Local CCP,"VIVA HEALTH, INC.",VIVA Medicare,UAB Health System,4,3,2,5,3,2,5,3,5,4,4,3,3,3,4,3,3,3,4,5,2,5,4,5,2,5,5,5,5,5,4,5,5,1,1,5,5,5,5,5,5,4,5,3,3,3,4
H0174,Local CCP,"TODAY'S OPTIONS OF TEXAS, INC.",Universal American Corp.,Universal American Corp.,Plan too new to be measured,Plan too new to be measured,Plan too new to be measured,Plan too new to be measured,Plan too new to be measured,Plan too new to be measured,Plan too new to be measured,Plan too new to be measured,Plan too new to be measured,Plan too new to be measured,Plan too new to be measured,Plan too new to be measured,Plan too new to be measured,Plan too new to be measured,Plan too new to be measured,Plan too new to be measured,Plan too new to be measured,Plan too new to be measured,Plan too new to be measured,Plan too new to be measured,Plan too new to be measured,Plan too new to be measured,Plan too new to be measured,Plan too new to be measured,Plan too new to be measured,Plan too new to be measured,Plan too new to be measured,Plan too new to be measured,Plan too new to be measured,Plan too new to be measured,Plan too new to be measured,Plan too new to be measured,Plan too new to be measured,Plan too new to be measured,Plan too new to be measured,Plan too new to be measured,Plan too new to be measured,Plan too new to be measured,Plan too new to be measured,Plan too new to be measured,Plan too new to be measured,Plan too new to be measured,Plan too new to be measured,Plan too new to be measured,Plan too new to be measured,Plan too new to be measured,Plan too new to be measured
H0192,Demo,"AMERIHEALTH MICHIGAN, INC.",AmeriHealth Caritas VIP Care Plus,Independence Blue Cross,Plan too new to be measured,Plan too new to be measured,Plan too new to be measured,Plan too new to be measured,Plan too new to be measured,Plan too new to be measured,Plan too new to be measured,Plan not required to report measure,Plan not required to report measure,Plan not required to report measure,Plan not required to report measure,Plan too new to be measured,Plan too new to be measured,Plan too new to be measured,Plan too new to be measured,Plan too new to be measured,Plan too new to be measured,Plan too new to be measured,Plan too new to be measured,Plan too new to be measured,Plan too new to be measured,Plan too new to be measured,Plan too new to be measured,Plan too new to be measured,Plan too new to be measured,Plan too new to be measured,Plan too new to be measured,Plan too new to be measured,Plan too new to be measured,Plan too new to be measured,Plan too new to be measured,Not enough data available,Not enough data available,Plan too new to be measured,Plan too new to be measured,Plan too new to be measured,Plan too new to be measured,Plan too new to be measured,Plan too new to be measured,Plan too new to be measured,Plan too new to be measured,Plan too new to be measured,Plan too new to be measured,Plan too new to be measured,Plan too new to be measured,Plan too new to be measured,Plan too new to be measured
H0251,Local CCP,"UNITEDHEALTHCARE PLAN OF THE RIVER VALLEY, INC.",UnitedHealthcare Community Plan,"UnitedHealth Group, Inc.",2,2,3,4,4,1,4,1,5,3,4,2,2,3,3,3,2,4,3,4,3,5,3,4,3,4,5,5,4,4,3,5,5,5,5,4,5,5,5,5,4,3,2,3,2,3,3
H0281,Demo,ILLINICARE HEALTH PLAN,IlliniCare Health,Centene Corporation,Plan too new to be measured,Plan too new to be measured,Plan too new to be measured,Plan too new to be measured,Plan too new to be measured,Plan too new to be measured,Plan too new to be measured,Plan not required to report measure,Plan not required to report measure,Plan not required to report measure,Plan not required to report measure,Plan too new to be measured,Plan too new to be measured,Plan too new to be measured,Plan too new to be measured,Plan too new to be measured,Plan too new to be measured,Plan too new to be measured,Plan too new to be measured,Plan too new to be measured,Plan too new to be measured,Plan too new to be measured,Plan too new to be measured,Plan too new to be measured,Plan too new to be measured,Plan too new to be measured,Not enough data available,Plan too new to be measured,Plan too new to be measured,Plan too new to be measured,Plan too new to be measured,Not enough data available,Not enough data available,Not enough data available,Plan too new to be measured,Plan too new to be measured,Not enough data available,Plan too new to be measured,Plan too new to be measured,Plan too new to be measured,Plan too new to be measured,No data available,No data available,No data available,No data available,No data available,No data available
H0294,Local CCP,CARE IMPROVEMENT PLUS WISCONSIN INSURANCE COMPANY,Care Improvement Plus,"UnitedHealth Group, Inc.",5,2,2,Plan too new to be measured,Plan too new to be measured,1,4,1,5,4,4,Not enough data available,3,4,4,3,5,1,2,4,5,3,4,1,4,3,4,5,2,5,3,5,5,5,Not enough data available,3,4,5,3,1,2,3,5,4,5,4,3
H0302,Local CCP,"MEDISUN, INC.",Blue Cross Blue Shield of Arizona Advantage,"Veritage, LLC",4,4,3,4,5,4,5,Plan not required to report measure,Plan not required to report measure,Plan not required to report measure,Plan not required to report measure,2,2,3,4,4,2,2,4,3,3,4,3,4,4,4,5,5,3,4,3,5,5,1,1,4,5,5,5,5,4,4,3,4,5,4,1
H0321,Local CCP,"ARIZONA PHYSICIANS IPA, INC.",UnitedHealthcare Community Plan,"UnitedHealth Group, Inc.",3,2,1,3,1,2,4,1,4,2,4,2,3,3,3,2,2,3,4,3,2,3,3,3,3,4,5,5,3,4,4,5,5,5,4,4,5,5,3,2,2,3,3,3,2,3,2
H0332,Local CCP,"KS PLAN ADMINISTRATORS, LLC",KelseyCare Advantage,"Kelsey-Seybold Medical Group, PLLC",5,5,5,3,4,5,5,Plan not required to report measure,Plan not required to report measure,Plan not required to report measure,Plan not required to report measure,3,4,5,5,4,4,2,4,5,5,5,5,5,5,4,5,5,3,3,5,4,5,1,1,4,5,5,5,5,5,3,5,4,5,5,5
